{
  "incident_id": "case_B",
  "task_type": "evidence_grounded_attack_chain_reconstruction",
  "task_instruction": "Reconstruct a structured, temporally ordered, evidence-supported attack chain. Select supporting evidence IDs from evidence_cards. Do not invent facts that are not supported.",
  "incident_brief": "A web application incident contains repeated admin activity and unusual application, network, and system-call observations. Use only the provided log observation cards to reconstruct what the attacker did, in order, and cite evidence for each step.",
  "required_output": {
    "incident_summary": "short free-text summary",
    "attack_chain": [
      {
        "step_id": "S1",
        "order": 1,
        "attack_step": "short step title",
        "step_description": "what happened and why it matters",
        "tactic": "MITRE ATT&CK tactic",
        "technique_id": "MITRE ATT&CK technique ID",
        "technique_name": "MITRE ATT&CK technique name",
        "entities": {
          "files": [],
          "processes": [],
          "hosts": [],
          "urls": [],
          "accounts": []
        },
        "supporting_evidence": [
          "EVIDENCE_ID"
        ],
        "confidence": "low|medium|high"
      }
    ],
    "causal_edges": [
      {
        "source": "S1",
        "target": "S2",
        "relation": "temporal_after|enables|uses_output_of|same_session_sequence",
        "supporting_evidence": [
          "EVIDENCE_ID"
        ]
      }
    ]
  },
  "evidence_cards": [
    {
      "evidence_id": "E0001",
      "card_type": "log_observation",
      "source_type": "log_observation",
      "content": "{\"evt.category\": \"file\", \"evt.datetime\": \"2025-01-16 05:43:15.562331699\", \"evt.rawres\": -2, \"evt.time\": \"05:43:15.562331699\", \"evt.type\": \"stat\", \"proc.cmdline\": \"https-jsse-nio- -Dlog4j.configurationFile=/usr/src/apache-ofbiz/framework/base/config/log4j2.xml -agentlib:jdwp=transport=dt_socket,server=y,suspend=n,address=5005 -jar ./build/libs/ofbiz.jar\", \"proc.exepath\": \"/usr/local/openjdk-8/bin/java\", \"proc.name\": \"https-jsse-nio-\"}",
      "line": 10194798,
      "timestamp": "2025-01-16 05:43:15.562331699",
      "extracted_clues": {
        "paths": [
          "/build/libs/ofbiz.jar",
          "/usr/local/openjdk-8/bin/java",
          "/usr/src/apache-ofbiz/framework/base/config/log4j2.xml"
        ],
        "endpoints": [
          "/build/libs/ofbiz.jar",
          "/usr/local/openjdk-8/bin/java",
          "/usr/src/apache-ofbiz/framework/base/config/log4j2.xml"
        ],
        "ips": [],
        "ports": [],
        "files": [],
        "processes": [],
        "accounts": [],
        "syscalls": [
          "stat"
        ]
      }
    },
    {
      "evidence_id": "E0002",
      "card_type": "log_observation",
      "source_type": "log_observation",
      "content": "{\"evt.arg.data\": \" </link>. </menu-item>. </menu>. <menu name=\\\"OrganizationAccou\", \"evt.category\": \"file\", \"evt.datetime\": \"2025-01-16 05:43:15.568434919\", \"evt.rawres\": 8192, \"evt.time\": \"05:43:15.568434919\", \"evt.type\": \"read\", \"fd.name\": \"/usr/src/apache-ofbiz/applications/accounting/widget/AccountingMenus.xml\", \"fd.type\": \"file\", \"proc.cmdline\": \"https-jsse-nio- -Dlog4j.configurationFile=/usr/src/apache-ofbiz/framework/base/config/log4j2.xml -agentlib:jdwp=transport=dt_socket,server=y,suspend=n,address=5005 -jar ./build/libs/ofbiz.jar\", \"proc.exepath\": \"/usr/local/openjdk-8/bin/java\", \"proc.name\": \"https-jsse-nio-\"}",
      "line": 10194834,
      "timestamp": "2025-01-16 05:43:15.568434919",
      "extracted_clues": {
        "paths": [
          "/build/libs/ofbiz.jar",
          "/link",
          "/menu",
          "/menu-item",
          "/usr/local/openjdk-8/bin/java",
          "/usr/src/apache-ofbiz/applications/accounting/widget/AccountingMenus.xml",
          "/usr/src/apache-ofbiz/framework/base/config/log4j2.xml"
        ],
        "endpoints": [
          "/build/libs/ofbiz.jar",
          "/link",
          "/menu",
          "/menu-item",
          "/usr/local/openjdk-8/bin/java",
          "/usr/src/apache-ofbiz/applications/accounting/widget/AccountingMenus.xml",
          "/usr/src/apache-ofbiz/framework/base/config/log4j2.xml"
        ],
        "ips": [],
        "ports": [],
        "files": [],
        "processes": [],
        "accounts": [],
        "syscalls": [
          "read"
        ]
      }
    },
    {
      "evidence_id": "E0003",
      "card_type": "log_observation",
      "source_type": "log_observation",
      "content": "{\"evt.category\": \"file\", \"evt.datetime\": \"2025-01-16 05:43:15.571117662\", \"evt.rawres\": -2, \"evt.time\": \"05:43:15.571117662\", \"evt.type\": \"stat\", \"proc.cmdline\": \"https-jsse-nio- -Dlog4j.configurationFile=/usr/src/apache-ofbiz/framework/base/config/log4j2.xml -agentlib:jdwp=transport=dt_socket,server=y,suspend=n,address=5005 -jar ./build/libs/ofbiz.jar\", \"proc.exepath\": \"/usr/local/openjdk-8/bin/java\", \"proc.name\": \"https-jsse-nio-\"}",
      "line": 10194860,
      "timestamp": "2025-01-16 05:43:15.571117662",
      "extracted_clues": {
        "paths": [
          "/build/libs/ofbiz.jar",
          "/usr/local/openjdk-8/bin/java",
          "/usr/src/apache-ofbiz/framework/base/config/log4j2.xml"
        ],
        "endpoints": [
          "/build/libs/ofbiz.jar",
          "/usr/local/openjdk-8/bin/java",
          "/usr/src/apache-ofbiz/framework/base/config/log4j2.xml"
        ],
        "ips": [],
        "ports": [],
        "files": [],
        "processes": [],
        "accounts": [],
        "syscalls": [
          "stat"
        ]
      }
    },
    {
      "evidence_id": "E0004",
      "card_type": "log_observation",
      "source_type": "log_observation",
      "content": "{\"evt.category\": \"file\", \"evt.datetime\": \"2025-01-16 05:43:15.571124602\", \"evt.rawres\": -2, \"evt.time\": \"05:43:15.571124602\", \"evt.type\": \"stat\", \"proc.cmdline\": \"https-jsse-nio- -Dlog4j.configurationFile=/usr/src/apache-ofbiz/framework/base/config/log4j2.xml -agentlib:jdwp=transport=dt_socket,server=y,suspend=n,address=5005 -jar ./build/libs/ofbiz.jar\", \"proc.exepath\": \"/usr/local/openjdk-8/bin/java\", \"proc.name\": \"https-jsse-nio-\"}",
      "line": 10194861,
      "timestamp": "2025-01-16 05:43:15.571124602",
      "extracted_clues": {
        "paths": [
          "/build/libs/ofbiz.jar",
          "/usr/local/openjdk-8/bin/java",
          "/usr/src/apache-ofbiz/framework/base/config/log4j2.xml"
        ],
        "endpoints": [
          "/build/libs/ofbiz.jar",
          "/usr/local/openjdk-8/bin/java",
          "/usr/src/apache-ofbiz/framework/base/config/log4j2.xml"
        ],
        "ips": [],
        "ports": [],
        "files": [],
        "processes": [],
        "accounts": [],
        "syscalls": [
          "stat"
        ]
      }
    },
    {
      "evidence_id": "E0005",
      "card_type": "log_observation",
      "source_type": "log_observation",
      "content": "{\"evt.category\": \"file\", \"evt.datetime\": \"2025-01-16 05:43:15.571155074\", \"evt.rawres\": -2, \"evt.time\": \"05:43:15.571155074\", \"evt.type\": \"stat\", \"proc.cmdline\": \"https-jsse-nio- -Dlog4j.configurationFile=/usr/src/apache-ofbiz/framework/base/config/log4j2.xml -agentlib:jdwp=transport=dt_socket,server=y,suspend=n,address=5005 -jar ./build/libs/ofbiz.jar\", \"proc.exepath\": \"/usr/local/openjdk-8/bin/java\", \"proc.name\": \"https-jsse-nio-\"}",
      "line": 10194863,
      "timestamp": "2025-01-16 05:43:15.571155074",
      "extracted_clues": {
        "paths": [
          "/build/libs/ofbiz.jar",
          "/usr/local/openjdk-8/bin/java",
          "/usr/src/apache-ofbiz/framework/base/config/log4j2.xml"
        ],
        "endpoints": [
          "/build/libs/ofbiz.jar",
          "/usr/local/openjdk-8/bin/java",
          "/usr/src/apache-ofbiz/framework/base/config/log4j2.xml"
        ],
        "ips": [],
        "ports": [],
        "files": [],
        "processes": [],
        "accounts": [],
        "syscalls": [
          "stat"
        ]
      }
    },
    {
      "evidence_id": "E0006",
      "card_type": "log_observation",
      "source_type": "log_observation",
      "content": "{\"evt.category\": \"file\", \"evt.datetime\": \"2025-01-16 05:43:15.571341796\", \"evt.rawres\": -2, \"evt.time\": \"05:43:15.571341796\", \"evt.type\": \"stat\", \"proc.cmdline\": \"https-jsse-nio- -Dlog4j.configurationFile=/usr/src/apache-ofbiz/framework/base/config/log4j2.xml -agentlib:jdwp=transport=dt_socket,server=y,suspend=n,address=5005 -jar ./build/libs/ofbiz.jar\", \"proc.exepath\": \"/usr/local/openjdk-8/bin/java\", \"proc.name\": \"https-jsse-nio-\"}",
      "line": 10194891,
      "timestamp": "2025-01-16 05:43:15.571341796",
      "extracted_clues": {
        "paths": [
          "/build/libs/ofbiz.jar",
          "/usr/local/openjdk-8/bin/java",
          "/usr/src/apache-ofbiz/framework/base/config/log4j2.xml"
        ],
        "endpoints": [
          "/build/libs/ofbiz.jar",
          "/usr/local/openjdk-8/bin/java",
          "/usr/src/apache-ofbiz/framework/base/config/log4j2.xml"
        ],
        "ips": [],
        "ports": [],
        "files": [],
        "processes": [],
        "accounts": [],
        "syscalls": [
          "stat"
        ]
      }
    },
    {
      "evidence_id": "E0007",
      "card_type": "log_observation",
      "source_type": "log_observation",